{
  "schema_version": 1,
  "authority": "state",
  "component": "application",
  "facts": {
    "feedback": {
      "auto_expiry_policy": "unknown"
    },
    "storage": {
      "schema_version": 1,
      "v2_migration": "not_implemented",
      "future_version_policy": "unknown"
    },
    "validation": {
      "automated_tests": 4
    }
  }
}
